id,sentences
1bah1b0,"So, you need to put more force and a longer throw into the turning stalk for the signal to be enabled in constant mode - that required far more pressure than I have ever used in a car (and trucks!"
1bah1b0,") before, it was entirely distracting for me."
1bah1b0,"And I've had arthritis for decades, so it actually caused discomfort by the end of the day."
1bah1b0,The turning stalk was the only part of the car that I felt truly sucked.
1bah1b0,"Well, auto wiper mode too, but I used the manual speeds just fine."
1bah1b0,I didn't realize there was a glove compartment until after accidentally finding its control in the UI.
1bah1b0,Maybe that's for valet-like security reasons?
1bah1b0,"Perhaps they consider the center armrest storage area to be your everyday needs area, with the glove compartment for less frequently-used items."
1bah1b0,"Still, the center storage areas were too open-ended and needed organizers."
1bah1b0,"The phone wireless charger area barely fit my Google Pixel 8 Pro with Otterbox Defender case, it was a super tight fit."
1bah1b0,So I put my phone sideways over the charging spots and it threatened to fall off at times.
1bah1b0,"The rear hatch did not close properly on two occassions, I had to push down to make it latch."
1bah1b0,"Opening doors with a button press is interesting and I tried to press a nonexistent button in an ICE car after dropping off the Tesla, realizing how quickly I got used to it."
1bah1b0,"The outer door handles were likely flush for aerodynamic reasons, so I can't complain about their two-step design for opening a door."
1bah1b0,**Sales experience**  I was entirely misled on pricing by a Tesla Sales Rep who called me after my second test drive.
1bah1b0,"He offered a discount on the price of a configuration we discussed and I asked if that was out-the-door pricing - he said yes, twice."
1bah1b0,"Turns out he lied or was not understanding, because when I visited the link he sent for my target car build, it included $3600 off for an estimated $1200/year savings over three years against gas prices - but that was not off the purchase price."
1bah1b0,"This turned out to be a standard Tesla marketing tactic to grab eyeballs, but he said in the call that it represented a ""discount"" that applied to out-the-door pricing when we talked and I had no visuals in front of me as a reference at the time."
1bah1b0,"So, I told them that it really made me lose trust in Tesla's ability to make a deal, then he went onto autopilot by asking when we would make the sale happen over the next two weeks, until I complained to him about being tone-deaf and reading from a script."
1bah1b0,"Then I provided very clear, negative feedback about that sales experience to Tesla from a survey request they sent me."
1bah1b0,He actually apologized a week later and then went back into autopilot sales mode.
1bah1b0,"I've since been browsing inventory on my own, bypassing the Reps."
1bah1b0,"Their representation of that anticipated gas price savings has since changed in their marketing, it's now more obvious."
1bah1b0,"Kind of a coincidence, maybe other people have complained, too."
1bah1b0,"**TLDR**  * I'm still shopping for my first EV, the Model Y is at a reasonable price-point that it couldn't be ignored."
1bah1b0,"* Impressive technology, great use of it for enabling driver awareness of their surroundings."
1bah1b0,"* Top-notch navigation and charging experiences, which are also nicely integrated."
1bah1b0,"* Tesla requires learning their different driving and controls experience, but you can get the basics down easily and refine your skills over time."
1bah1b0,It doesn't stop you from driving the car on Day 1.
1bah1b0,* Lack of separating status from controls in the UI seems not ideal and caused physical issues for me.
1bah1b0,"* Physical comfort (for me) is on the negative side, but not extremely so."
1bah1b0,"* The car has an unrefined, hard ride but is sort of acceptable."
1bah1b0,"* Usability has pluses and minuses, almost equally so."
1bah1b0,"* Marketing and sales experience was sour, but I found going on your own bypasses the bs - their online buying experience is very smooth."
1bah1b0,"* Pricing reflects that this is a premium EV, mostly due to the strong tech and charging network."
1bah1b0,Other aspects don't feel consistently premium and need further refinement - perhaps that's what Juniper will start to offer.
1bah1b0,"* It's not the top of my EV choice list, but may be a backup option due to pricing."
9upkqe,"Regarding Autopilot “assertiveness”I remember watching a Mobileye presentation where the speaker, an esteemed researcher in the autonomous driving field, talked about an “assertiveness” factor when it comes to self-driving cars."
9upkqe,"Take a taxi driver, for example, when they are able to time and drive themselves quickly for lane changes."
9upkqe,"In socially accepted places, you would say they are being assertive and the aggressiveness is forgiven and not considered rude as they are simply asserting their urgency given the situation."
9upkqe,"Their directional movements have cue, giving clues to the direction they wish to take and other drivers around them are able to flow with it."
9upkqe,Take the other opposite where you have a hesitant driver and their indicisiveness is more annoying and disruptive to the flow of traffic.
9upkqe,You can’t tell what decision they will take.
9upkqe,Assertiveness does not mean aggressive or rude.
9upkqe,"It’s the skill to cue intent, time movements, decide space, predict position, and assert or make space."
9upkqe,It’s clear that Tesla’s AP or any AP has no notion of assertiveness.
9upkqe,It follows blind rules and follows its pacing indifferent to cars around it.
9upkqe,If it were a human driver we’d call it clueless or rather cue-less.
9upkqe,What would it take to program assertiveness into AP?
9upkqe,"(If anyone has seen that talk, please post the link."
9upkqe,")  Edit: if I may add, technology is  nowhere near the ability to have assertiveness."
9upkqe,Humans can predict.
9upkqe,We can see if other drivers are looking at us or if they are looking at all.
9upkqe,We can see the subtle directional cues of other cars by how their wheels are turned or by the slight change in angle of the car preparing to change lanes.
9upkqe,We respond to dozens or hundreds of cues going on around us constantly.
9upkqe,"Treat AP as an augmentation assistant, not Automation."
1bikbws,"My review of the V12, non social media influencer, rarely talks about good things about FSD in this sub."
1bikbws,"I'm just going to let out my thought stream from the moment I left the garage:  Ok, let's try my neighborhood, they said lack of lanes are better now."
1bikbws,Let's engage it.
1bikbws,Hmm...
1bikbws,"Not bad, it's staying to the right side quite well, but what is this, my grandma driving?"
1bikbws,"Now coming up on the first stop sign, no one around and..."
1bikbws,"Wait, what's the car doing?"
1bikbws,Is this thing going to go?
1bikbws,Uhh...
1bikbws,"ok, first intervention, press on the pedal to tell it to go."
1bikbws,"Second stop sign now, same thing!"
1bikbws,Wtf.
1bikbws,Accelerator pedal.
1bikbws,Let's go car!
1bikbws,"Ok it's picking up speed, FAST."
1bikbws,"I like it, but I can see how some people won't like this."
1bikbws,(Fast forward past another stop sign).
1bikbws,"Ok speed limit is 50, everyone else going 60, why is this thing going 43."
1bikbws,Seriously did they use my grandma as training data?
1bikbws,"Intervention, accelerator pedals pressed."
1bikbws,Ok here comes that left turn with an immediate merge after the left.
1bikbws,I always have to disengage here.
1bikbws,It...
1bikbws,did it perfectly?
1bikbws,Uhh...
1bikbws,how?
1bikbws,Was that just luck?
1bikbws,Further testing is needed.
1bikbws,Why is it going so slow?
1bikbws,Omg they need to stop using my grandma as training data!
1bikbws,(As I continue down the road I realized I can change my settings.
1bikbws,"Set it to ""assertive"")  Car immediately speeds up, starts changing lanes the way I would do it exactly."
1bikbws,WOW.
1bikbws,Now this car drives exactly like I would.
1bikbws,Can't believe all it took was setting it from normal to assertive.
1bikbws,"Here comes a right turn lane that the car always turns into in the middle of an intersection, I always have to disengage here."
1bikbws,Wait...
1bikbws,is this doing it correctly?
1bikbws,Wow.
1bikbws,No way.
1bikbws,Did they happen to update the maps too or is this V12?
1bikbws,Did it just go into this roundabout that doesn't have any traffic without stopping?
1bikbws,About damn time it's doing it right!
1bikbws,Wow it just made this protected right turn without stopping?
1bikbws,What's going on?
1bikbws,Is someone remotely driving my car?
1bikbws,Arrived.
1bikbws,Wow.
1bikbws,"Other than the grandma driving, ZERO disengagements!"
1bikbws,Went through construction and all the other failure parts I've had before with no issues.
1bikbws,"Grandma driving may have been cause by my settings, so more testing is needed for that leg of the trip, but V12 **may** make me a believer once again."
1bikbws,"We'll see, V11 was amazing at the start too until it degraded into a pile of shit."
1bikbws,We'll see if future version of V12 is any better.
1bikbws,I am cautiously hopeful once again.
qg65dl,"Poor FSD Beta performance, am I the only one?"
qg65dl,"I'm not going to lie, I was super excited to get to finally try the FSD Beta to see what progress had been made through these years of waiting."
qg65dl,When I finally got the build pushed to my car I took it for a daily commute to the gym.
qg65dl,Here's how it went.
qg65dl,The profile is on Assertive btw.
qg65dl,Driving through the neighborhood I understand it treats it as any other road but the car travels literally in the middle of the road so I have to disable it until I get out of neighborhood.
qg65dl,"Turning out of neighborhood the creep is so slow and when it finally decides to go after sitting for a little while with no cars coming, it's just too slow."
qg65dl,"Here's where I was pretty impressed at the 4 way stop sign, it does really well at detected when it's turn is but again it's commitment to go is just way to slow so I find myself always on the acceleration pedal to speed it along before someone honks at me."
qg65dl,"When entering a 2 lane left turn, it chose the one on the very left and what shocked me was it committed too hard and fast this time yanking me into the furthest lane."
qg65dl,It then failed to correctly make the turn though.
qg65dl,It also failed to make the turn at the light to my gym but that turn is a bit hard because of how sharp it is.
qg65dl,I drive this commute every single day so I hope to see FSD grow enough to where I can actually babysit it and not intervene every second.
qg65dl,I just wanted to share my experience with it and a bit of my disappointment as I've had FSD for around 3 years now.
g7fzd7,Autopilot stopping for stop sign in 2020.12.6
17bjt07,Tesla release 2023.27.7 including FSD Beta v11.4.
17bjt07,"7.3Notes state:   -Improved short-deadline lane changes, to avoid going off-route, through better modeling of target lane vehicles to improve gap selection assertiveness."
17bjt07,- Improved offset consistency when controlling for static obstacles.
17bjt07,Also improved smoothness when changing offset direction by adjusting speed more comfortably.
17bjt07,- Improved handling of oncoming cars on narrow unmarked roads by improving prediction of oncoming car's trajectory and leaving enough room for them to pass before re-centering.
17bjt07,- Improved Occupancy Flow prediction from the Occupancy Network for arbitrary moving obstacles by 8%.
17bjt07,"- Expanded usage of the new object ground truth autolabeler for the NonVRU detection model, improving distant vehicle recall and geometry precision for semi-trucks, trailers, and exotic vehicles."
17bjt07,- Improved VRU control by expanding planning scope to control gently for low-confidence detections that may interfere with ego's path.
17bjt07,- Improved handling for VRUs near crosswalks by predicting their future intent more accurately.
17bjt07,This was done by leveraging more kinematic data to improve association between crosswalks and VRUs.
17bjt07,- Improved ego's behavior near VRUs by tuning their assumed kinematic properties and utilizing available semantic information to classify more accurately their probability of intersecting ego's path.
17bjt07,- Improved Automatic Emergency Braking recall in response to cut-in vehicles and vehicles behind ego while reversing.
17bjt07,- Introduced Automatic Emergency Braking on general obstacles detected by Occupancy Network.
vvescr,Tesla Full Self-Driving Beta reacts quickly to pedestrian exiting their car
7dk7vx,I always thought the Porsche Mission E had cool headlights :)
fxwo3w,"Discounted new vehicle is claiming to be as-is**It's a long one, from a new owner."
fxwo3w,I'll try to make it at least interesting to read.
fxwo3w,"**  **TL;DR:**  I bought a new M3 LRAWD from Tesla with 1800mi on it, with a small discount off the list price, and they're trying to tell me that my new vehicle is as-is and the few material and workmanship defects I've found so far, such as as broken stitching and glued surfaces separating on the rear seats, are ""accounted for"" in the discount that was shown on the new vehicle listing."
fxwo3w,Looking for advice is anyone else got this kind of runaround.
fxwo3w,Hi Teslites!
fxwo3w,I took delivery of my new 2020 M3 about 2 weeks ago.
fxwo3w,"I chose it from the new vehicles page from Tesla rather than going through the order process since I needed a replacement vehicle asap because the insurance company totaled my current ICE vehicle (Honda Fit, 10+ years 150K mi) because the transmission died after hitting a very deep pothole."
fxwo3w,"I had been on the Tesla bandwagon from go, dying to own one ever since driving a Model S rental from Enterprise Exotics out in Vegas, but having a solid vehicle with no previous history of mechanical failure made it an expense I didn't really want to take on unless I had to."
fxwo3w,Enter serendipity.
fxwo3w,I ordered a M3 LR AWD in Black with FSD from the new vehicles page and it was being transported from VA.
fxwo3w,"Since I was give the option and I wasn't sure about FSD yet, I had them remove it prior to delivery."
fxwo3w,The vehicle had 1800 miles on it and I was told it was used as part of a dealer's fleet but it was still a new vehicle with all the same warranties.
fxwo3w,"Things didn't start off too swift the communications, I filled out all the paperwork on my side,applied for the financing via the site, and just had one modification that needed to be made to the down payment since some of it was coming from my insurance company through a special rider I had on he policy for vehicle purchase assistance (for totaled cars)   I got a runaround from the dealer saying they can't change anything on the financing, so I asked for contact info for the underwriting bank, and they said there is none and it's all 'automatic' through the website."
fxwo3w,"After a few e-mails that had to be ""escalated"" they managed to update down payment so I completed everything and waited for a delivery appt."
fxwo3w,"Got a call a few days later saying it got in earlier than expected, so set up an appt to go pick it up, return a rental, etc."
fxwo3w,and I felt it was a little bit off that they insisted I complete the paperwork in the showroom prior to even seeing the vehicle.
fxwo3w,"It was a new car, so I told that shoulder-devil to shut up and stop worrying."
fxwo3w,"It honestly didn't even occur to me to look at it prior doing the paperwork, after all I never asked pizza hut to show me the pizza before I paid them."
fxwo3w,"So everything done, my soul was being shipped off to be encumbered by the bank and they took me out to see the car."
fxwo3w,"First thing I noticed, a knuckle length gouge on the rim."
fxwo3w,"There were some minor scuffs on the rear fender, which I didn't care much about because I'd probably scuff it on the first wash anyway."
fxwo3w,"When I asked about the rim, (Mind, this was AFTER they had me sign all the paperwork) they said that was ""accounted for in the discounted price""  and I told them I can't accept it like that and after some of the 'let me talk to my manager' nonsense, they said they'd escalate it."
fxwo3w,"I trusted them, and..."
fxwo3w,at this point I was stranded with no car without getting another rental.
fxwo3w,"Well, I never got any communication from them until I contacted them again, and after sending off an e-mail to the delivery team, I didn't get any reply, but two days later a service center near me txt'd me and said they got the parts in and I had to ask them what parts?"
fxwo3w,"They sent a new rim to the service center, so I got an appt together for that and to install a homelink, which, for some reason tesla shipped directly to me from the Tesla store (along with ordering the home connector) instead of the service center, which the service center said was 'really weird, but who knows!"
fxwo3w,"'  So, everything is good for the time being, it's a blast to drive, nothing beats going flatout on an empty freeway to pass 18 wheelers at light speed, range is great, and I took it for my daily commute and 1 trip and have about 800 miles on it in 2 weeks."
fxwo3w,"Then I took my wife's family for an inaugural drive and one of the buckles on the rear seat wouldn't latch at all, nothing stuck in the buckle, just would not click."
fxwo3w,"So, setup another service appt."
fxwo3w,"Some TXTs later, they said they won't have the part in time for the appt, so they'd set it up for a mobile install later."
fxwo3w,NBD.
fxwo3w,"Next day I was sweeping out and putting in some new floor mats and noticed what looked like water damaged (p)leather on the rear seats, glue that was separating from the plastic shroud and what looked like a broken stitch."
fxwo3w,This is the same seat that had the broken buckle.
fxwo3w,Now I'm strongly suspecting this new 'dealer fleet' vehicle was used with an improperly installed car seat for it's first 1800 miles of life.
fxwo3w,"SIDEBAR: someone correct me if I'm wrong, but I assume cars returned under the 7 day/1000mi policy can't be resold as brand new, at least not without some kind of disclosure, right?"
fxwo3w,Since the vehicles would have to have been titled at least once previously.
fxwo3w,Now the song and dance begins with me adding the new concerns to the mobile appt.
fxwo3w,"which I was fairly certain that they wouldn't be able to fix mobile, but I wanted it recorded at least."
fxwo3w,After adding that and the pictures.
fxwo3w,Another problem shows up.
fxwo3w,I dropped and managed to kick my wallet under the car when I was getting ready to leave.
fxwo3w,"so in fetching it, I notice a big spot, about the size of an oreo, but the creme filling part, because it was white,   on the bottom of the front bumper."
fxwo3w,"I inspected it and it looks like it was a strike or impact, but, it was very smoothly sanded like it was being prepped for paint but never painted."
fxwo3w,"It should go without saying, I didn't strike anything, never bottomed out, and it's just about invisible when doing a normal walk around."
fxwo3w,"I had scheduled an appointment a few weeks from now to have the PPF installed on the whole front end, but this wasn't acceptable."
fxwo3w,"Service center send me a text saying for the seat and the spot, I had to reach out to the delivery team because *NEITHER* of them was a warranty service issue."
fxwo3w,"Now, if the spot was my fault, I'd understand that, but the seat?"
fxwo3w,Separating glued surfaces and broken stitching isn't a defect in workmanship?
fxwo3w,"So, I get in touch with delivery and here's their response:  Hi livingthepuglife,  I was passed along an email from TheDude in regards to your vehicle."
fxwo3w,During your delivery appointment we went over your vehicle extensively.
fxwo3w,"I also informed you that you were purchasing a vehicle with a price adjustment, and went over what that meant."
fxwo3w,Vehicles with price adjustments are sold as is.
fxwo3w,The adjustment on the vehicle accounts for any wear and mileage the vehicle has.
fxwo3w,"Tesla’s are sold with the pricing that you see online, any price adjustment on top of this is to account for mileage and wear."
fxwo3w,"In terms of fitment of the panels, our service team can check them for fitment."
fxwo3w,"If they are outside of specification, they of course, will be adjusted properly for you."
fxwo3w,Please let me know if there are any questions you have going forward.
fxwo3w,"Kind Regards,  Guy with an inadvertently funny name  **|  Operations Manager**  He also included the scanned copy of the delivery form, which he had attached with a kind of unearned confidence that it vindicated his answer (it didn't."
fxwo3w,It's literally the part of the paperwork that says I'm taking the vehicle.
fxwo3w,"There is no implicit or explicit language about condition or warranties)  So, I had to play the part of a simple country lawyer and review every piece of paper and e-mail that I got from Tesla, the original listing, the warranty (both new and used warranty since now I was concerned that I somehow bought a used car, which would be problematic for my insurance company and the settlement I got from them since I was required to buy a new vehicle) and I guess to no one's surprise, there's no language in any tesla warranty or document about discounts or as-is, because in all reality, I'm about 80% confident there's no such thing as an as-is New car."
fxwo3w,"There was also no documentation that had my signature that had any inspection report, list of defects etc."
fxwo3w,"And when I asked in my first reply, the guy completely ignores my request and tries to restate the same thing he said before about discounted vehicles being sold as-is."
fxwo3w,"I check google, I can't find anyone, anywhere using this kind of terminology in regard to tesla, or even new cars in general."
fxwo3w,"There were some back and forths so far, and this guy with the inadvertently funny name wants to stand hard and fast on his assertion above and before I have to put my foot in my mouth maybe someone can tell me:  **IS THIS A THING?"
fxwo3w,**  Has anyone else been told this on a new vehicle or a new vehicle from the listings on the tesla website?
fxwo3w,"With me keeping in mind, he tried to pull this same assertion on a damaged rim, and now I'm seriously concerned about the service I'm going to receive in the future."
fxwo3w,"Although the service team has been actually good so far, and all the mouth sewage seems to be coming from the delivery team or operations manager."
fxwo3w,"I'm now past the ""return period"" so I can't tell them to stuff it and order a new one, the discount on the list price on the website wouldn't have even covered the cost to replace gouged rim if I was doing it out of pocket."
fxwo3w,(Based off the SC's written estimate after they fixed it under warranty)
v7cws0,"Advice for FSD Beta settingsNew to FSD beta and wonder if I should recalibrate my cameras, or change any of my autopilot settings for a smoother ride and turns"
vf9rr2,FSD Beta Chill/Average/Assertive Modes - Anyone Actually Done a Repeatable Test To See If There Is A Difference?
vf9rr2,I'm of the opinion that it was a UI implementation that was never actually leveraged.
vf9rr2,"Back in the good ol' Rolling Stop days, maybe, but now?"
vf9rr2,Thoughts?
1bxz92a,Road trip.
1bxz92a,FSD vs Cruise controlDid about 200 mile road trip with my X (2017 P100DL).
1bxz92a,Did about half the trip in FSD 11.4.
1bxz92a,9 and half in cruise.
1bxz92a,"I enjoyed the traffic aware cruise more than FSD because it didn't keep bugging me with wheel shake requests even if I had to remember to stay in the lanes myself, it kept distance from other cars still fine."
1bxz92a,"Maybe a bit more conservative than I'd have been even on full assertive, but acceptable."
1bxz92a,First part had a few congested spots and FSD shines in that.
1bxz92a,"Also at dusk when the illumination changed from light to dark, noticed the visualization would lose the lanes when FSD/cruise engaged but show the cars."
1bxz92a,"If I disengaged, the lanes came back."
1bxz92a,Repeated that several times on both legs.
13au775,FSD being a prick?
13au775,Any one else have since update notice FSD being a pit assertive with paying attention like I can be looking straight and boom lol…
17smku5,European Tesla Owners Deserve a Full Refund for FSDThe topic I'm bringing to our community today is straightforward: All European Tesla owners who purchased Full Self-Driving (FSD) should be entitled to a full refund.
17smku5,Here’s why:  1.
17smku5,**Unfulfilled Promises**: The core of the issue is simple – the FSD feature has not lived up to the expectations set by Tesla.
17smku5,"In Europe, the functionality is extremely limited, if not entirely non-existent."
17smku5,2.
17smku5,**Regulatory Challenges**: European road regulations vary significantly and are often stricter compared to other regions.
17smku5,"This has severely hindered the capabilities of FSD, making its promised features more of a concept than a reality for us."
17smku5,3.
17smku5,**Financial Fairness**: The cost of FSD is substantial.
17smku5,"We’ve invested in a feature that, as it stands, we can’t fully use."
17smku5,"In any other situation, paying for a service or product that can’t be used as advertised would naturally lead to a refund."
17smku5,4.
17smku5,**A Call for Collective Action**: This isn’t just an individual concern but a collective issue for all European Tesla owners.
17smku5,It's crucial that we come together to voice this need for a refund clearly and assertively.
17smku5,5.
