id,sentences
7ifdjd,Supercharger stations are Tesla’s secret that other EV manufacturers dare not mention.
7ifdjd,There is something to a system with an incentive to make it succeed.
7ifdjd,Two shared J1772 stations that don’t work in a makeshift spot at a dealer’s lot who could care less = a bad experience.
7ifdjd,Multiply across the land and it’s a bad experience multiplied.
7ifdjd,A Nissan Leaf is a car I can have less anxiety about when parking.
7ifdjd,"If you don’t want attention, it’s a subtle car without the fuss."
7ifdjd,There are humans who envy if they see you in a Tesla and their lesser natures are revealed.
7ifdjd,The Nissan Leaf is affordable for what it offers.
7ifdjd,"They both don’t have drag-free coasting, zero-regen mode which Ioniq and e-Golf have."
7ifdjd,Except those other cars don’t have decent Level 2 the way Leaf and Model 3 do.
7ifdjd,What’s a guy to do.
c4gv6b,AP1 improvements - 2019.20.2.
c4gv6b,1Hi - so received the update last night for my MS 85D and today drove 350 miles to the beach.
c4gv6b,Noticing a few tweaks that have improved AP1 a bit.
c4gv6b,"First is the when there is a truck or car next to you hugging the line and the sonar symbols got yellow, my car would move over in the lane to add some distance."
c4gv6b,First time I’ve seen it do this consistently every time.
c4gv6b,Second - lane changes with AP1 on seem to be much quicker now and more abrupt.
c4gv6b,Very nice.
1c1pmgp,How would you describe the difference between chill/average/aggressive modes in FSD v12?
1c1pmgp,Which one do you prefer to use regularly?
1c1pmgp,*assertive (thanks u/Corndog_Farkle)  [View Poll](https://www.
1c1pmgp,reddit.com/poll/1c1pmgp)
1bofwqi,City Streets/Highway FSD Inflection PointI’ve been putting heavy miles on v12.3+ that include a lot of city streets-to-highway-to-city streets action.
1bofwqi,"In my opinion, we’ve reached the inflection point where the city streets stack is better in most ways than the legacy highway stack."
1bofwqi,"The main areas that highlight this for me are:  **Planning** — 12.3’s lane selection, opportunism in getting into gaps in traffic, and generally not getting itself into positions where it risks missing a turn are better than the highway stack, which still doesn’t plan far enough ahead and often isn’t assertive enough to do what needs to be done in heavy traffic."
1bofwqi,"**Speed Control** — Despite the bug that makes 12.3 drive extra slow sometimes, when it works the “just flow with traffic” setting is great."
1bofwqi,Far better than the rudimentary “pick a speed limit offset and hope it’s similar to what other people are doing” thing is on the highway.
1bofwqi,"**Maneuvering** — I never thought much of it until now, but highway driving feels very robotic after feeling how 12.3 changes lanes, assertiveness, and overall driving *feel*."
1bofwqi,This has caught me off guard because I had just accepted that the reverse was always true and likely would be well into the future.
1bofwqi,Makes me wonder how long until everything is unified on the E2E NN architecture…
12bfep7,FSD 11 Highway Lane HuggingI had a 4 hour highway drive yesterday and I was really impressed with FSD 11.3.
12bfep7,5.
12bfep7,One major behavior change that I really enjoyed was the car will hug the opposite side of the lane if you are next to or passing a large vehicle or tractor trailer.
12bfep7,It also handles lanes that are lined with cones much better.
12bfep7,"Also, you can left and right click the right hand scroll wheel to adjust between chill, average, and assertive."
12bfep7,This works incredibly well.
12bfep7,Chill will stay in your lane and very rarely change lanes to pass if not required.
12bfep7,Average will take most opportunities to get in the faster lane.
12bfep7,"Finally, I’ve noticed the time between nags seems to be much longer than before."
12bfep7,This is a huge improvement on the highway over the legacy autopilot stack.
12bfep7,Great work Tesla team!
16ovyus,My thoughts on FSDFor the next month I have quite a few 3+ hour one way drives for work so I decided to do one month of the FSD subscription.
16ovyus,Today was day 1 and I used it for a total of 4 hours.
16ovyus,"Pros:  - It was nice to sit back and let the car do the work and made the drive a little less painful - I liked not having to think too much about when my exits are coming up - it was nice to be able to subscribe last night and get in the car this morning and everything was ready to go without an additional sw update needed - a little bit fun and enjoyable for the short term  Cons: - was a little scary at times not gonna lie, the auto lane change was happing more than I would have thought and any time the speed limit changed to something lower fsd slammed on the brakes even when nothing was in front of me (I guess that’s phantom braking?"
16ovyus,?
16ovyus,") - obviously is not 100% reliable, it got confused when going onto exit ramps or merging and I took over multiple times because I didn’t know what to expect  - local roads it is still very finicky on, missed my turn completely which was fine because I was testing it out but it didn’t impede on my trip  - I have the auto Lane change set to average which I didn’t expect much from but I think I should’ve kept it on chill because it was in my opinion very assertive, I can only imagine what “aggressive” mode is like but I don’t want to find out  Overall: would I spend $15k on it?"
16ovyus,Absolutely not.
16ovyus,For the multiple drives I’m taking in one month is it worth the $200?
16ovyus,Sure but I would only subscribe when I need it and if I knew there were multiple long trips or one really long trip coming up…would not pay for just one short ride.
16ovyus,Is it something that I felt 100% safe and care free in?
16ovyus,"No, you definitely need to be vigilant, but maybe it just takes getting used to."
16ovyus,"Otherwise, pleasantly surprised at how it made a 3 hour rush hour less work and brainpower"
1c4n8q6,FSD not respecting speed limits?
1c4n8q6,Recently I have had issues with FSD v12 taking forever to slow down when the speed limit decreases.
1c4n8q6,Some places this is not really an issue and probably what most human drivers would do but it becomes problematic when the limit goes from 80 km/h to 40 km/h into a school zone or on some of our highways where the speed regularly goes from 90 km/h to 50 km/h through small towns where the speed is regularly patrolled.
1c4n8q6,The car definitely knows the speed limit as it shows the correct limit on screen and FSD does not even slow down if I try to manually use the scroll wheel to slow it.
1c4n8q6,Its quite frustrating as im having to take over frequently for this.
17a6caj,11.4.
17a6caj,7.2 won't exit passing lane when stalk is manually pressed and continual occlusion warningsdrove from Houston to Daytona beach yesterday and had some new issues with new fsd release.
17a6caj,"after passing vehicles in passing lane, i manually pushed stalk to initiate lane change back to cruising lane."
17a6caj,signal would flash but M3 would not exit the passing lane in timely fashion.
17a6caj,"vehicles behind me, anxious for me to return to cruising lane so they could pass me often began cutting into cruising lane to pass me on right before my M3 would execute lane change."
17a6caj,embarrassing to sit in the lane with the signal on but not moving over and dangerous since understandably annoyed drivers behind me would often begin to make their move into the cruising lane at same time M3 eventually decided to move over.
17a6caj,this happened inconsistently but most times it exhibited this behavior.
17a6caj,"also, when driving at night, got continual warnings about fsd being degraded due to one or more side camera occluded."
17a6caj,"as there were many (many, many) recharging stops on this trip, i cleaned the cameras several times to no avail."
17a6caj,still love the car and fsd but this was new behavior for me and my 2020 M3 RWD.
zul7t9,TACC + Autosteer not slowing down for lane merges?
zul7t9,"Note: I don't have FSD, just the basic TACC + Autosteer on an early 2021 Model 3."
zul7t9,"When driving on a highway, I tend to just stay in the right lane at 65-75mph, turn on TACC + Autosteer, and mostly let the car do its thing."
zul7t9,"In a lot of highways, the right lane sometimes abruptly ends and merges into the lane to the left of it."
zul7t9,Or an entirely new set of vehicles is merging onto the highway from the right side into my lane.
zul7t9,Why can the TACC + Autosteer not detect this and slow down?
zul7t9,"90% of the time, it DOESN'T do what a human would do, which is to slow down and let the slightly faster car on your right that is clearly attempting to switch into your lane actually complete the lane change."
zul7t9,"Instead, Autosteer stubbornly maintains its speed and it has caused some near-misses for me where the merge lane on my right was ending and the driver just barely switched into my lane before it ended."
zul7t9,I always end up needing to take control and avoid a potential collision by either slowing down rapidly or speeding up really fast.
zul7t9,"I know the full FSD has drive settings for assertiveness, does that fix this?"
zul7t9,Or is this only a problem in the TACC + Autosteer combo?
zul7t9,I'm just surprised that it can't handle this scenario while working almost flawlessly otherwise.
hcybcs,"The Oatmeal • Magical Space Car Revisited(I posted this earlier on TMC forum, then thought y’all might like to see it too."
hcybcs,)  I’ve had my Model S Long Range Plus for a couple of months now.
hcybcs,"I was just taking another look at this old cartoon → [https://theoatmeal.com/comics/tesla\_model\_s](https://theoatmeal.com/comics/tesla_model_s)      I’m not sure if that was first published in 2012 or 2013, but it must  have been thereabouts."
hcybcs,"In 2020 is the Model S still a Magical Space Car,  an Intergalactic SpaceBoat of Light and Wonder, an Electric  CruiseBeast?"
hcybcs,"Or is it, as CNET Roadshow asserted, in dire need of a  refresh?"
hcybcs,Mine is different in a number of notable ways from the car that The Oatmeal gushed over.
hcybcs,RANGE.
hcybcs,"He wrote: “After seven months and 4,000+ miles of owning a Model  S, any ‘range anxiety’ I used to have has been completely quelled”."
hcybcs,"Also, “I have the 85 KWh battery, which can go up to 260 miles on a  single charge”."
hcybcs,"When I placed my order for a S Long Range, it was advertised as having  373 miles range."
hcybcs,"Before my car was built, Tesla switched production to  the Long Range Plus version, and a few days ago I got my firmware update  to the new official 402 miles EPA rating."
hcybcs,"After having the car for a  couple of months I am beginning to understand, in practical terms, just  how much overkill that is."
hcybcs,"Also, when it comes to charging stations…  Man, the Supercharger network today is a world beyond the fledgling  network that The Oatmeal barely mentioned in passing."
hcybcs,The whole USA is  valid for road trips now.
hcybcs,It’s almost too easy.
hcybcs,"If anything, I might  sort of miss the pioneering spirit that driving cross-country in an EV  required only a few years ago."
hcybcs,Where’s the challenge now?
hcybcs,CAMPING.
hcybcs,"On the subject of driving cross-country… When The Oatmeal  published his story, camping in Teslas hadn’t even really been  discovered yet."
hcybcs,"One lady here in town peeked in the back of my car and  gasped, “It has more space than my Ford Explorer!"
hcybcs,"” Yes, there is plenty  of room to stretch out."
hcybcs,It could charge from an RV hookup while I sleep  in the back.
hcybcs,"That reminds me, I need to put in my order for a Dreamcase."
hcybcs,THE ACCELERATION.
hcybcs,"Quote, “My Model S can go from 0-60 in five seconds,  and because it’s completely noiseless, accelerating feels like being  fired out of a gun with a silencer on”."
hcybcs,I’ve sometimes wondered if I should have splashed out the extra cash  (lots of it!
hcybcs,) for a Performance model.
hcybcs,Then I notice that my LR+ can do  0-60 in 3.7 seconds.
hcybcs,That is not a slow car by any means.
hcybcs,My old Lotus  Esprit V8 couldn’t match that.
hcybcs,"(I think the Lotus might have an  advantage in overtaking at highway speed, but not by very much."
hcybcs,") By the  way, I do notice torque steer when I floor the S. It’s not ideal, but I  can live with that."
hcybcs,"It adds a bit of extra drama to launches, as the  wheel jerks in my hands and I hang on for dear life."
hcybcs,OLD AND BUSTED.
hcybcs,"According to CNET Roadshow, “One area where the Model S  is clearly lagging behind is design”."
hcybcs,"Also, “Things are beginning to  look awfully plain”."
hcybcs,"Also, “In a segment that prioritizes freshness,  visually, the Model S is anything but”."
hcybcs,I laughed and laughed at this.
hcybcs,"Well, I guess it must depend on where you  live."
hcybcs,"If you are in California and there have been Model Ses swarming  around you on the highways for years, then maybe it looks plain to you."
hcybcs,I  live in Texas.
hcybcs,"Rural, small-town Texas."
hcybcs,"My car is still a novelty here,  drawing plenty of both questions and compliments."
hcybcs,"And I think it still  looks great, especially in a world that is being gradually taken over by  chunky, homely, generic SUVs and crossovers."
hcybcs,My main gripe about the Model S’s appearance is one that could apply to  all Teslas now.
hcybcs,The selection of factory colors is very limited.
hcybcs,"I  happen to like bright, vivid colors, and you can get any bright color  you want as long as it’s red."
hcybcs,"I admit the red does look good, but still…  We need more color on our highways, and I’ve been feeling a little envy  towards all those Jeep Wranglers around town that look like they  escaped from a bag of Skittles."
hcybcs,That’s why I bought a white Model S and  am getting it wrapped in “Atomic Teal” vinyl.
hcybcs,THE CLASSIC.
hcybcs,"The Oatmeal observed, “Being fully electric, the Model S is  completely noiseless, which was jarring at first because every time I  came to a stop I thought that the motor had stalled."
hcybcs,It also makes  parking lots rather interesting because pedestrians can’t hear my Ultra  Stealth NinjaCar as it approaches”.
hcybcs,Regulations have been on the books for a few years now requiring  electric cars to have pedestrian warning systems (noise makers)  operating at low speeds.
hcybcs,"However, actually pinning down the details of  those regs and getting them into effect has been delayed and delayed."
hcybcs,"The Model 3 now comes with a noise maker, but my Model S LR+ doesn’t  have one."
hcybcs,Maybe I got one of the last cars to be free from that nuisance  feature of dubious worth.
hcybcs,"Likewise, there have been persistent rumors of the Model S and X getting  a single landscape-oriented screen like the 3 and Y, but mine still has  both the dash display and the large, portrait-oriented screen."
hcybcs,"Personally, I like it that way."
hcybcs,"More screen is more better, and I find  the portrait screen divides up nicely into map, camera and music  windows."
hcybcs,"Oh, and then there’s the Unlimited Free Supercharging."
hcybcs,"It may be  somewhat wasted on me, as I don’t expect to use it heavily, but hey…  That’s still pretty sweet to have."
hcybcs,"To all those guys who are still waiting because they think there’s a  refresh right around the corner… Enjoy your pedestrian noisemakers,  piddling little landscape screen and paying for Supercharging."
hcybcs,I will be  happy with my “classic” Model S.      CHALLENGE ACCEPTED.
hcybcs,"Shortly after getting my car, I took it out for a  spin on one damp morning after some spring showers, and I went around  the county’s dirt roads."
hcybcs,The sure-footedness of this heavy car as it  splashed through puddles and around muddy corners was amazing.
hcybcs,"I felt  perfect control, never a hint of slippage."
hcybcs,"Dual-motor all-wheel-drive,  with precise, electronic modulation of power front-and-rear, is a  wonderful thing."
hcybcs,Washing all that mud off afterwards was less wonderful.
hcybcs,Car needs a non-stick coating.
hcybcs,"Are you working on that, Elon?"
hcybcs,"Next I went down to “The Farm” which is notorious for its neglected,  rocky, washed-out road."
hcybcs,"I dialed the suspension up to maximum height and  slowly, carefully eased the car down the road and over the rocks — with  it beeping and flashing warnings at me the entire way, but it never did  actually scrape bottom."
hcybcs,So… Why do I need a SUV again?
1bz1idl,FSD drives below the speed limit?
1bz1idl,"I am not sure how common this is, I asked Tesla employees about this and they said they do not have this issue."
1bz1idl,"I have my car in assertive, I also have the speed limit offset to be 5mph faster than the speed limit."
1bz1idl,"When I had the regular autopilot, it worked great and would go the speed I set it to, but with FSD it drives so slow."
1bz1idl,"Keep in mind I am talking about when no cars are around, and when they are around, it does not matter the condition it will always drive below the speed limit for me."
1bz1idl,Do you have this issue too?
1bz1idl,I have a 2023 M3P
1ce0v6t,What do I do?
1ce0v6t,What happened?
117rji1,"FSD unusable but easy for Tesla to fixWith FSD active, no matter what profile you set - chill, average, assertive - the car will often change into the left lane when the travel speed is less than the set speed."
117rji1,"Many people set a delta speed target so that they are not impeding traffic flow, but they certainly don't want the car to constantly change lanes and annoy everyone."
117rji1,It even does this when you have an upcoming right turn in 500ft.
117rji1,Ridiculous.
117rji1,There's no reason to have chill/average/assertive control follow distance either - there's an easy scroll wheel follow distance setting.
117rji1,They need a separate setting to control speed-based lane changes.
117rji1,And have a lane change - 'only for exits' option that never does speed related lane changes.
117rji1,The user can then flip the turn signal to get FSD to make a lane change when this option is active.
117rji1,"As is, this is completely unusable."
117rji1,I'm effectively unable to use AutoSteer with an FSD user settings profile.
19en9h1,"FSD beta QuestionAll right, quick dumb question."
19en9h1,"I signed up for the full self driving subscription, and want to make sure I’m on the beta program."
19en9h1,"It says full self driving, (beta), but I don’t see a separate button for request full self driving beta like I see to look for online."
19en9h1,Do I have the beta just the full release?
1bv4hkq,Would you take this trip?
1bv4hkq,Debating whether to take my new M3 or my ICE car on this trip.
1bv4hkq,If I hit traffic or something i will need to stop and charge earlier?
1btkqq5,"FSD Trial Day 1 LearningsDrove 400 miles today for work with the vast majority being on FSD today, my first day of the trial (2022 MYP)."
1btkqq5,"Mix of interstate, backroads, and city driving."
1btkqq5,Never had/used FSD before so what an opportune day to start my trial.
1btkqq5,I tried Chill and Average.
1btkqq5,Did not try Assertive mode.
1btkqq5,"Here are some things I noticed:  —As someone else mentioned, FSD brakes way too late and way too hard for my liking at times."
1btkqq5,Definitely created some uncomfortable stops.
1btkqq5,"—I drive like a grandma so the hard acceleration from every stop when no other vehicles were in front not only annoyed me, but made me think people who use FSD heavily must go thru tires much more quickly."
1btkqq5,"—FSD really struggled to capture new speed limits and change speeds, especially at 65mph limit; Happened probably 10x where it would still show 55mph."
1btkqq5,"—I do not like constantly being in the middle lane on 3-lane highway, usually I use the slow lane."
1btkqq5,FSD definitely prefers middle lane.
1btkqq5,"—Furthermore, on 2-lane roads, it kept putting me in the fast lane despite me sticking to the speed limit."
1btkqq5,Big pet peeve when not actively passing.
1btkqq5,—FSD struggled to accelerate from lights when trucks/slow vehicles were in front of me.
1btkqq5,It kept leaping forward only to have to slow right back down.
1btkqq5,"—Lastly, FSD adjustment to new speed limits was lethargic and erratic at best."
1btkqq5,I feel like Autopilot handles this better.
1btkqq5,"Haven’t tried AutoPark or Summon yet, but neither have much appeal to me."
1btkqq5,"I know it’s only the first day, but this definitely is not worth the money to me over basic AP."
1biwsig,Super excited!
1biwsig,Getting FSD 12.3 now!
1biwsig,Let’s go!
v382sk,"My robotaxi driver (FSD) is rated as a poor driver (53%) by the State Farm AppWith all the talk about safety scores, I think it’s always important to continue to rate the source."
v382sk,"If robotaxis are to become a thing, and they will all have the same driver, that driver needs to be a good driver."
v382sk,I don’t know the best app to use but State Farm has one that appears to be good and free so I tried using that to rate FSD as a driver.
v382sk,I ran the first one this morning which was a 2 mile commute from home to my office.
v382sk,10.12.2.
v382sk,"The 2 mile commute has two left turns, one at a stop sign, one at a light, and two right turns, one at a stop sign and one at a light."
v382sk,"7:30 am, moderate traffic."
v382sk,In that short trip I got 9 alerts.
v382sk,"4 rapid acceleration, 3 hard braking and 2 sharp cornering."
v382sk,One really pissed off driver in another car.
v382sk,53% score.
v382sk,"While I appreciate the focus on complicated unprotected left turns and other sexy AI problems, I think the autopilot team needs to address simple things like not freaking out my family and the other drivers around me."
v382sk,I looked this up before posting and see only posts on Tesla’s Safe Driving Score.
v382sk,Does anyone else use a strategy/app to rate FSD as a driver?
kjscj8,Matrix headlights are for FSDI think the new matrix headlights will be used by FSD to communicate with other drivers and pedestrians.
kjscj8,"The lights can fade/""nod"" to be submissive or brighten/""widen"" to be assertive."
aimclp,Xpeng G3 – Tesla Knock-Off now available in China
eoxry7,Autopilot veered off on uneven surface on a freeway.
eoxry7,That was unexpected.
eoxry7,I have done over 15.000 miles on autopilot and I'm very happy with it.
eoxry7,I have driven over this little dent in the freeway hundreds of times without any issues until yesterday.
eoxry7,The car veered off without any warning.
eoxry7,"No blinker, no chimes, no flashing warnings on the console."
eoxry7,I could feel that the autopilot was turning the steering wheel left.
eoxry7,"Luckily, I was paying attention and I took over in the nick of time."
eoxry7,"There was a car in the lane on the left and I'm sure he wasn't pleased with that maneuver, either."
eoxry7,It goes to show that one really should keep a hand on the steering wheel when driving on autopilot.
eoxry7,Dashcam video:  [https://imgur.com/4F0bkVz](https://imgur.com/4F0bkVz)
62zis4,Help defend us at /r/place!
62zis4,We're getting slammed
icpntl,"As someone who does not send their food back when the order is wrong because shy, how do I properly refuse the car during delivery day?"
icpntl,TLDR at the bottom.
icpntl,I am expecting delivery of the Y soon and I have a list of things I can inspect in/on the car to see if it should be sent back/should I refuse delivery.
icpntl,I am nervous because of all the negative reviews people have been posting on this sub.
icpntl,I want some help on what should I do if and when I find something wrong with the car.
icpntl,"For someone who is very shy, I never send back food, or complain that my friend didn't pay me back enough money that they borrowed, or return a shirt I bought from amazon because it was the wrong size."
icpntl,"The first and only car that I actually bought, I ended up paying $3k more because I didn't know how to negotiate/haggle."
icpntl,"Much of this is because I am introverted, anxious, and just feel like I am being rude."
icpntl,"A little bit of it is because I am also lazy, I don't want to get through all the trouble just to get something small fixed to what I want."
icpntl,When I was young it was my mother who would take care of things.
icpntl,Now I just have me.
icpntl,"However, you guys all know, this thing isn't just a $20 shirt or a $12 food."
icpntl,I will be sinking $60k into this car so I actually want what I ordered.
icpntl,"I have always wanted a tesla and now that it is in within my reach, I am getting more nervous every day when I see a bad review."
icpntl,I was wondering if you guys have any advice on what I should say/do should I refuse delivery of my car.
icpntl,I want to be assertive but not sound like an entitled a\*\*hole.
icpntl,"Everyone keeps saying ""refuse at delivery"" but I actually don't understand how that works."
icpntl,Should I just literally turn around and walk away?
icpntl,Should I say a few things?
icpntl,Tell em a piece of my mind?
icpntl,Should I call my mom to do it for me?
icpntl,"But in all seriousness, I would like some help on what I should do at the door."
icpntl,I am hoping and praying I don't need to do this but at the very least I want to be prepared.
icpntl,I haven't seen it posted here so I thought I should give it a shot.
icpntl,"If we get enough replies, people can also use this thread if they are someone like me."
icpntl,&#x200B;  **TLDR:** I am a shy person and I was wondering if you have tips on how to refuse my car on delivery.
eoso3q,I bought a used Tesla Model S four months agoand I still haven't gotten app access!
eoso3q,It's killing me!
