id,sentences
zzgpqn,End of the day the work had not started and I was given an estimate for completion at the end of Tuesday.
zzgpqn,End of Tuesday Valerie called me and said the work was difficult and my car was old so they needed another service tech to work on it.
zzgpqn,I asked when the car would be done and she said it was maybe Wednesday or Thursday.
zzgpqn,"I requested a loaner since this was the fifth time they were trying to fix things, I had already spent $500 last time for this same fix and they already had the car for two days."
zzgpqn,This is when everything went off the rails.
zzgpqn,Valerie kept saying that my car was out of warranty and I would not get a loaner.
zzgpqn,She suggested that I trade in the car for parts and buy a new car as they have some kind of promotion going.
zzgpqn,**Sell a working car for a warning light.
zzgpqn,"** I told her that if I had known that it would take four to five days, I would have rented a car."
zzgpqn,"She said my car was old and the repair difficult, I mentioned that she knew on Monday this was the case."
zzgpqn,She again mentioned I was out of warranty.
zzgpqn,Fine I asked her if the tire pressure issue was on the ticket.
zzgpqn,She said they check the tire every visit.
zzgpqn,I again reiterate that my first chat message detailed the issue with the tire.
zzgpqn,Was that on the ticket?
zzgpqn,She said I should have put that in the original appointment on the app and not the chat.
zzgpqn,I did not remind her of our first discussion about this but asked her to put it on the ticket now which she said she would.
zzgpqn,I requested the name of a manager.
zzgpqn,I was given an email for Robert Garcia.
zzgpqn,Day 3.
zzgpqn,Emailed Robert and spelled out all that had happened.
zzgpqn,His response was terse but professional.
zzgpqn,He would make sure the TPMS warning light issue would be taken care of and I would get a loaner.
zzgpqn,So I sent a message to Valerie on the app requesting a loaner and also left a voice message.
zzgpqn,This was at 1pm.
zzgpqn,I received a message on the app at 5:10 pm that since it was so late they could not clean a car in time to give me a loaner as they close at 5pm.
zzgpqn,I emailed Robert with this update and requested the loaner in the morning.
zzgpqn,Day 4.
zzgpqn,Robert emails saying the vehicle is done and the TPMS issue resolved.
zzgpqn,Great.
zzgpqn,I emailed back asking if I can pick up the car as the app had not sent an updated estimate or a bill to accept.
zzgpqn,I also wanted to know if the wheel issue was taken care of.
zzgpqn,Valerie calls 11 am asking about the wheel issue.
zzgpqn,I again read her the very first chat message I had sent four days ago now detailing that there was an issue with the tire.
zzgpqn,She said I should have said tire and not wheel.
zzgpqn,Again I reiterated that in the chat and when I had spoken to her several times earlier I had said “tire” and wanted it put on the ticket.
zzgpqn,She again went into her script about being out of warranty and how I should use the app.
zzgpqn,"I simply requested her to have a tech look at the tire to see if there was a leak, if there was to replace the tire."
zzgpqn,If they could not get this done in one day I would come by now and pick up a loaner.
zzgpqn,She said her tech was out for lunch and would look at the tire at 1pm.
zzgpqn,"At 3 pm, I sent a string of emails to Robert, the app, and a voice mail at Tesla service."
zzgpqn,No replies.
zzgpqn,At 4pm I simply state in the app that I will be coming to pick up the car or a loaner.
zzgpqn,"On the Lyft ride there I get a message on the app saying that they close at 5pm, I am out of warranty and I will not get a loaner."
zzgpqn,I copy an image of that and email it to Robert.
zzgpqn,He emails back saying I should speak with Valerie to get a loaner as it seems the car is not complete.
zzgpqn,I get to the service station at 4:30.
zzgpqn,The only person working the counter is Valerie.
zzgpqn,I say hello and request either my car or a loaner.
zzgpqn,Here things go from bad to worse.
zzgpqn,Valerie comes through with all the things I have done wrong:  1.
zzgpqn,Why did I not come earlier?
zzgpqn,"(I had no communication from her, Robert or the app to come earlier)  2."
zzgpqn,You can't show up 30 minutes before closing expecting a loander.
zzgpqn,(If I had known to come earlier I would have).
zzgpqn,3.
zzgpqn,"I did not approve the estimate (I was never given an estimate, while we were speaking she sent an estimate and pointed to my phone saying see there it is, I told her I literally saw her just send it)."
zzgpqn,4.
zzgpqn,I need to talk to Robert not her (This is after she said Robert had left - so we both know he is not there.
zzgpqn,She was basically saying this is all Robert's fault and you need to take it up with him not me).
zzgpqn,5.
zzgpqn,Why had I not added the tire to the original ticket (that ticket was made by the service rep because the service before did not fix the problem).
zzgpqn,Each time I show her either the email or chat message or show her that I never received an updated estimate or message to come and get a loaner or my vehicle.
zzgpqn,She went over the estimate ($1500 to upgrade the harness - again I told her this is the fifth time and I had already paid last time and the initial estimate was $0).
zzgpqn,At every interaction she seemed to want to escalate.
zzgpqn,She would point things out that I had incorrectly and when given the email/app messages to the contrary would move to the next things.
zzgpqn,I am sad to say that I reached my limit at this point and went off for about 20 seconds.
zzgpqn,I told her that if they are competing with BMW/Mercedes/Lexus in terms of service they are not close (Valerie asserted that they were not competing against them by the way).
zzgpqn,She then told me the best she could do is get someone to fix the tire after hours and I could leave with my car.
zzgpqn,"During that time I emailed Robert, I got an automated message saying he had left for the day and would be back 01/03."
zzgpqn,"Finally another manager named Shawn came out, I gave him the synopsis."
zzgpqn,He said they would get the tire fixed and I would get my car.
zzgpqn,"I asked him what would happen, if as I am driving home,  the warning light pops back on."
zzgpqn,He gave me his cell number and said just call me if that happens.
zzgpqn,"As I waited for the tire to get fixed I introduced myself to every interested person picking up a Tesla in the showroom (they also need more sales associates as that now takes more than an hour), and told them my five appointment story about getting a warning light fixed."
zzgpqn,They are probably ok if under warranty and probably even more ok if they don't come to the Raleigh service center.
zzgpqn,"Finally got my car back after an hour, the loose screw noise was still present."
zzgpqn,"Called Shawn, he and I took a drive and he set up another appointment for Jan 24."
zzgpqn,In retrospect.
zzgpqn,Both Robert and Valerie are not good at working as a team to address customer issues.
zzgpqn,"Valerie is antagonistic, she is looking to get a reaction."
zzgpqn,"I am not sure if this is willful or her way of being ""helpful"" This service center is woefully inadequate for the amount of money you pay for the car."
qfwj20,10.3.
qfwj20,1 FSDBeta drive setting experienceTime to burn tonight and just curious how others’ experiences broke down by the new FSD drive setting.
qfwj20,"Yes, I know it’s an overly simplified poll, do your best to select best fit."
qfwj20,Can only do 6 options leave comment if Aggressive setting sucked.
qfwj20,[View Poll](https://www.
qfwj20,reddit.com/poll/qfwj20)
1d25scm,FSD option are not consistentOn FSD 12.3.
1d25scm,6 when I select assertive and speed offset.
1d25scm,1.
1d25scm,Sometimes I have noticed it goes back to normal from assertive so I have to manually put it back to assertive.
1d25scm,2.
1d25scm,Speed overset is not working on highways and I have to manually use the scroll wheel to adjust the speed any comments?
1bt6t21,12.3.
1bt6t21,3 Agressive Acceleration Hey Everyone!
1bt6t21,Just got the V12 update running 12.3.
1bt6t21,3 on my 22 MYLR.
1bt6t21,Love it so far other than the aforementioned speed issues.
1bt6t21,Does anyone have a problem with how quickly it accelerates off the line to the speed limit?
1bt6t21,I want to use FSD as much as possible but this driving style us incredibly inefficient and not comfortable for me or my passengers.
1bt6t21,"Should I leave a voice note for the FSD team with the ""autopilot disconnected, what happened""?"
1bt6t21,feature or is there a better way to send them feedback?
1bt6t21,Thanks  Kyle
15s0wtg,Someone in my apartment’s front office skipped science class.
15s0wtg,I back in to charge with the 120v outlet in my carport that management gave me permission and know I use.
15s0wtg,Gave me a chuckle seeing this on my windshield today
1bv641k,I had to give up FSD because they took away regular cruise control with fsd option active.
1bv641k,Unless am missing something ?
1bv641k,I really like FSD but  regular cruise control is what I use 90% cause it's a smooth ride with no surprises.
vfvsgv,Does supercharging your car multiple times really have a bad affect on the battery long term?
vfvsgv,"Hello Everyone,  I don’t have a place to charge my model 3 Tesla at my apartment and so I supercharge my car 1-2 times a week."
vfvsgv,I’ve seen so many people talk about only charging their car up to 80% but I have been going up to 90-100% and now I’m getting worried that this will affect my car.
128yxeu,Quick trip report report - Northern AZ to SoCal round tripJust got back from a road trip with my wife from my home in Northern AZ to downtown San Diego in my Model 3 Performance w/FSD Beta v11.3.
128yxeu,3.
128yxeu,Supercharging cost vs.
128yxeu,"gas cost - although I left my home with a 100% charge, my home charging costs are ridiculously low at $ 0.05 per kWh off-peak, so it’s negligible and I didn’t include this."
128yxeu,I only used Superchargers on the trip and didn’t use the heater or AC much.
128yxeu,Supercharger costs were $115.36.
128yxeu,"Using current AZ and CA average costs per gallon, a gas vehicle averaging 30 mpg would have paid approximately $148.96 in fuel."
128yxeu,It’s about what I expected; supercharging isn’t cheap but it’s cheaper than gas.
128yxeu,FSD behavior notes - v11.3.
128yxeu,3 really impressed me by how much improved it is vs.
128yxeu,FSD even a few months ago.
128yxeu,"In the city, it’s not hesitant."
128yxeu,"My setting is “assertive”, but the car will creep out to make right turns, and will make a left turn at a green light with an oncoming car visible; knowing it will complete the turn before the car arrives."
128yxeu,"Highway driving went well too, although a few times I had phantom braking in both FSD and AP."
128yxeu,"It seems to occur when the car approaches a slight hill, and also it seems to get fooled at the water “mirage” effect in the distance on the highway."
128yxeu,"I took it out of FSD a couple times on the highway as it was hugging the left lane’s outside line and made me nervous until I figured out that it would do this when I was passing a slower vehicle on the 2-lane highway and would hug the outside as I passed, especially semis."
128yxeu,"Night highway driving was fine too, but I got a warning that FSD performance would be degraded because of something (those notices turn off too quickly before you can read them IMO)."
128yxeu,The only head-scratcher was a bizarre moment when I’m heading to a SC that I know for sure I can make it easily.
128yxeu,"All of the sudden, the car slows down and tries to make get in the left lane to prepare for a u-turn, and the supercharger it now wants me to go to is back from the city I left nearly an hour ago."
128yxeu,I ignored that and took over and when I passed the u-turn point the nav re-calced and then pointed me to where I was going originally.
128yxeu,Weird.
128yxeu,"Also, FSD seems to change lanes randomly for some reason."
128yxeu,"For example, I had to make a a right exit off of the highway in a mile and I was already in the right lane."
128yxeu,"The car signaled and went into the left lane, and then less than a minute went back into the right lane to take the exit."
128yxeu,There was no traffic or other cars.
128yxeu,"Thanks for the read if you made it this far, and hope this helps!"
b9rsie,PSA for NoA: If it’s recommending lane changes too often make sure you’re not set to Mad MaxThis should be a sticky anytime NoA updates come out since we’re seeing so many posts about NoA suggesting too many lane changes.
b9rsie,"Mad Max DOES NOT make lane changes more assertive or aggressive, what is does do is suggest a lane change to overtake anyone going slower than the speed you set."
b9rsie,If you’re unhappy with how often NoA wants to change lanes to pass a car try setting it to “average” or even “mild”.
b9rsie,If anyone has had a different experience with these setting since the latest updates let us know.
aeb7ui,"Unusual conversation about Tesla with another EV ownerI encountered a Nissan Leaf owner today, we were both parking in a the EV area of my workplace."
aeb7ui,She saw me and asked how I liked my Tesla Model 3.
aeb7ui,I told her it is great.
aeb7ui,"She then stated ""It's just a smaller Model S, right""?"
aeb7ui,"I replied, uh, no, they're different cars."
aeb7ui,"She then reiterated her position that it's just a smaller Model S, using ""They look the same"" as her reasoning."
aeb7ui,"I replied, they're both Teslas, of course they might resemble each other."
aeb7ui,"Then she said ""But they both have a battery and a computer; they're the same""."
aeb7ui,"I replied that two BMW models might both have engines and steering wheels, but that hardly makes them ""the same"" vehicles."
aeb7ui,"Undeterred, she then continued on her line of reasoning, re-asserting that the Model 3 is just a smaller Model S. I replied with another analogy about Chevrolet making different cars, but that doesn't mean they're the same car."
aeb7ui,At this point we approached the doors to the building.
aeb7ui,I went ahead and walked slightly faster so I wouldn't have to talk to her anymore.
aeb7ui,"I'm not sure if she was just trying (and failing) to make small talk, was trying to criticize Tesla somehow, or was just massively mis-informed, but whatever it was, she wouldn't take my assertion that ""They're different cars""."
aeb7ui,Weird.
xyh3dx,"Finally got into FSD betaOTA was actually a little earlier in the week, but as it's actually the wife's kid hauler car, we didn't get to enable and try it out until today after work."
xyh3dx,I like to say that this is the first day we've gotten our full money's worth for the purchase price of the car (after more than 5 years of ownership).
xyh3dx,We tried it on the drive back home from the restaurant.
xyh3dx,"Overall, very impressive, though we had a few interventions."
xyh3dx,"And on one occasion, it pulled into a turn lane one block too soon, not sure what it would have done."
xyh3dx,Try to move back at the green?
xyh3dx,Take the wrong turn and re-route?
xyh3dx,"I'm frankly amazed at how aggressive/assertive it is; probably needs some getting used to, but it drives more aggressively than I do."
xyh3dx,Maybe it's just nerves due to first attempt.
banmbg,"Wouldn’t it be cool if we can give preparatory commands to NOA just to train it better“”Stay on this lane” - does not Mad Max  “Prepare to exit” - starts to make maneuvers to get on the eventual lane needed to exit  “Move to fast lane”  “Move left”  “Move right”  “Passive merge” - falls back to a merge  “Assertive merge” - speeds up to a merge  “Cancel exit” - cancels NOA, falls back to regular Lane Keeping”  “Station Keeping Mode” - stays in the flow of traffic, does not exceed standard deviation of speed relative to surrounding cars  “Dis/Activate audible” - turns audibles on or off"
6yy91t,"[Discussion] on measuring battery capacity/power in kilowatts instead of megajoulesThe watt is a confusing unit for me (and I'd bet most consumers) because it has time already factored into it, whereas the joule does not."
6yy91t,"Time being part of the unit breaks my ability to think of electricity as a fluid, like gas, that ""flows"" into my ""tank""."
6yy91t,"If I wanted to know how long it's going to take me to fill up a gas tank, I would expect to see gallons per hour."
6yy91t,"When I want to know how long it's going to take me to charge my battery, I want to see kilowatts per hour."
6yy91t,But that's wrong.
6yy91t,"Chargers are measured with kilowatts, because the ""per hour"" is already part of the watt unit."
6yy91t,So counterintuitive!
6yy91t,"Likewise, it's confusing that my battery holds some amount of watts ""an hour""."
6yy91t,"My battery should just hold X number of units, my brain doesn't intuitively understand what time has to do with it."
6yy91t,"If batteries were measured in megajoules, the units would all make more sense."
6yy91t,"A level 2 charger is 20 MJ/h, so if your battery ""holds"" 200MJ then it will take you 10 hours."
6yy91t,So much more intuitive.
6yy91t,"And lastly, just in terms of unit choices, the watt makes most sense when you want to know how much energy you're _using_, but the joule makes more sense when you want to know how much energy something _contains_."
6yy91t,"You can obviously use kWh to measure contained energy and Joule-hours for how much is being used, but that seems like measuring a gas tank with the unit gallons per hour * hour."
6yy91t,Did Tesla do market research and find that people understood kW units better?
6yy91t,Or was it just because it was easier for the engineers to think of things in terms of kW and that leaked into public info?
6yy91t,"Edit: the consensus in this thread seems to be ""it's not hard, people don't get confused"" which is  [clearly](https://www."
6yy91t,reddit.com/r/askscience/comments/2texot/how_much_power_wattshour_does_it_take_to_charge/) [not](https://www.
6yy91t,reddit.com/r/explainlikeimfive/comments/25drxx/eli5_kwhkw_what_exactly_is_this_exact_figure/) [true](https://www.
6yy91t,"reddit.com/r/teslamotors/comments/4d26ai/what_kind_of_kw_battery_takes_model_3_215_epa/d1n3kdc/), [people](https://www."
6yy91t,reddit.com/r/teslamotors/comments/3lgy9k/how_far_do_you_think_tesla_will_go_with_driving/cv6dlox/?
6yy91t,utm_content=permalink&utm_medium=front&utm_source=reddit&utm_name=teslamotors) [are](https://www.
6yy91t,reddit.com/r/teslamotors/comments/6ukjvb/why_is_no_one_talking_about_the_semi/dltdsir/) [constantly](https://www.
6yy91t,google.com/search?
6yy91t,q=site%3Areddit.com++%22kW%2C+not+kWh%22&oq=site%3Areddit.com++%22kW%2C+not+kWh%22&gs_l=psy-ab.
6yy91t,3...
6yy91t,14741.16116.0.
6yy91t,19486.2.
6yy91t,2.0.
6yy91t,0.0.
6yy91t,0.846.846.6-1.1.
6yy91t,0....
6yy91t,0...
6yy91t,1.1.
6yy91t,64.
6yy91t,psy-ab..
6yy91t,1.0.
6yy91t,0.
6yy91t,nssIubF3zDw) [trying](https://www.
6yy91t,reddit.com/r/teslamotors/comments/27eqku/unknowingly_took_a_picture_of_a_tesla_using_a/ci05g97/) [to](https://www.
6yy91t,reddit.com/r/teslamotors/comments/6yy91t/discussion_on_measuring_battery_capacitypower_in/dmr4qbm/) [switch](https://www.
6yy91t,reddit.com/r/teslamotors/comments/2ewk65/tesla_to_build_400_charging_points_in_120_chinese/ck3olrq/) up [kW](https://www.
6yy91t,google.com/search?
6yy91t,q=%2224+kw+battery%22+%22nissan+leaf%22&oq=%2224+kw+battery%22+%22nissan+leaf%22&gs_l=psy-ab.
6yy91t,3...
6yy91t,76646.79780.0.
6yy91t,80077.10.9.
6yy91t,0.0.
6yy91t,0.0.
6yy91t,0.0..
6yy91t,0.0....
6yy91t,0...
6yy91t,1.1.
6yy91t,64.
6yy91t,psy-ab..
6yy91t,10.0.
6yy91t,0.
6yy91t,vRk2_kquoWI) and  [kWh](https://www.
6yy91t,google.com/search?
6yy91t,q=%22kwh+charger%22+evse&oq=%22kwh+charger%22+evse&gs_l=psy-ab.
6yy91t,3...
6yy91t,8029.8531.0.
6yy91t,8685.4.
6yy91t,4.0.
6yy91t,0.0.
6yy91t,0.133.351.3j1.4.
6yy91t,0....
6yy91t,0...
6yy91t,1.1.
6yy91t,64.
6yy91t,psy-ab..
6yy91t,0.2.
6yy91t,214...
6yy91t,0i8i13i30k1j33i160k1.
6yy91t,oixay36TurE).
6yy91t,"Given that indisputable fact, let's not have any more assertions that the current system is ""easy"" nor any more explanations and clarifications or mansplaining about the difference between kW and kWh..."
6yy91t,"this is the Tesla subreddit, probably the place most likely in all the world to have people who already understand the difference."
1bvt8t5,FSD Supervised First Impression.
1bvt8t5,Wow!
1bvt8t5,Model 3 P 2022I just got the update to the latest V12.
1bvt8t5,X version.
1bvt8t5,this week.
1bvt8t5,"Been working at home so no need to go out, and when I had to it was late and raining hard."
1bvt8t5,I had used the prior 11.
1bvt8t5,X vintage for long trips mostly.
1bvt8t5,"tI was OK, like really good cruise control."
1bvt8t5,Street/City driving was a party trick.
1bvt8t5,"This version I just tried out on a short drive home from the grocery store, at lunch time, in northern New Jersey."
1bvt8t5,It handled some of the most difficult and sketchy driving I have ever seen.
1bvt8t5,I live off a main road that cuts from two lanes to one just before my turn off on the right.
1bvt8t5,And another lane merges into it from the right just as the merge comes on.
1bvt8t5,Its nuts for a human.
1bvt8t5,You have to spend 90% of your vision in the rear view wondering who is on a cell phone and going to smack into you.
1bvt8t5,The car put itself into the right lane before the merge.
1bvt8t5,It saw the traffic from the right and noticed the volume to the left and my turn coming.
1bvt8t5,"It literally sped up to ensure its place in the road, and only for a moment did a quick slow-down/speedup for like 1/2 a second as we approached merging cars from the right."
1bvt8t5,"Then as we approached my turn, while the two lanes went to one, it put on its blinker, slowed a bit, but hooked the turn like a pro probably at 8 mph  I am taking it out later on - I need to try this some more."
1bvt8t5,"The only thing I come away with is it drives like I would, maybe even more assertive."
1bvt8t5,I also had it in assertive mode.
1bvt8t5,This is MUCH different than prior to 12 - WOW!
1bvt8t5,&#x200B;
1cd3aqx,FSD Too Human-like?
1cd3aqx,"Overall I’m reasonably impressed after weeks of my FSD trial, but three seemingly easy things are consistently screwed-up IMO."
1cd3aqx,"Frustratingly, they seem to be exactly what annoying human drivers do: 1) Slows down BEFORE moving into the exit lane getting off a highway 2) Not getting up to proper highway speed BEFORE getting on a highway (embarrassing considering the pick-up that a Tesla has!"
1cd3aqx,) 3)  Staying in the left lane long after passing someone.
1cd3aqx,"Like I get all the challenges in making a car drive itself, but these should not be where it struggles!"
1cd3aqx,This should be the easy part.
1cd3aqx,Or are the programmers just poor drivers who camp in the left lane and get on and off highways at 45?
12btj82,FSD 11 changes to right scroll wheelNoticed the car length option changed to driving type options under Autopilot settings.
12btj82,So long car following distance.
1donvp9,FSD: Autopilot Disabling X TimesIs there any way to reset the X times autopilot has been disabled?
1donvp9,This is messed up.
1donvp9,That means one more incident and it will be disabled for a whole week.
1donvp9,"Since I am paying the monthly subscription for FSD, that results in a loss of $25 for a week."
1donvp9,That’s not right.
1donvp9,I’m paying for this.
1donvp9,I should have that week extended before my subscription renews.
1donvp9,I had to make a long trip recently but it had disabled for a whole week on me.
1donvp9,FSD could have really helped when I was driving that 1k mile trip up north.
1donvp9,"I have been using it without incident so there should be a rule:  - after so X days without incident, the X times disabled reduced should be reduced by 1 until it gets back to 0  Anyone?"
165kvv4,To Chill Mode or Not to Chill Mode - That Is The Question?
165kvv4,Just wondering if I'm the only one who enjoys Chill Mode more as of late versus Standard > Sport > Insanity > Ludicrous.
165kvv4,"Now, some 3 years into my Tesla journey, and having had a lot of seat miles in all 4 models (all dual-motors so that does play a factor), I find that I enjoy having the car set to 'Chill Mode' mode acceleration more than I do any of the other options for most everyday and highway driving."
165kvv4,"I've driven plenty of other cars with driver selectable ""nerfed"" power settings for economy, relaxed mode, or new driver mode in their de-rated power modes, and generally what you get is car the feels wonky."
165kvv4,"Anywhere from feeling like it's not getting enough fuel, to feeling like the pedal is dead, to throwing itself into higher/highest gears as soon as possible."
165kvv4,Not the case with the Tesla.
165kvv4,"The more I drive in this setting, I find that Tesla's programmers did an excellent job of calibration for this mode."
165kvv4,"The experience feels more akin to an \[Insert German V8 luxury car here\] where strength of the motor gives effortless thrust, but it is delivered in a controlled, firm and positive push versus and the assertive slaps of power of you get on throttle tip-in in Tesla's other acceleration modes."
165kvv4,"Chill definitely takes the edge off the frenetic pace and what can feel like a step-function response on the throttle application, without neutering the car."
165kvv4,&#x200B;  [View Poll](https://www.
165kvv4,reddit.com/poll/165kvv4)
128wvki,Anyone ran into this since the newest update?
128wvki,"(2022.45.13)I've played around with every slider and option while in park and no matter what I do, I can't get it to allow me to change the offset (or set speed) to fixed mode when in the full self-driving beta."
128wvki,Even stranger that it will let you change the percentage offset but not change to fixed.
128wvki,Maybe a glitch?
