id,sentences
14xsvag,When to have my breaks inspected/serviced?
14xsvag,"My '21 (Q4 2020) M3 (LR AWD w/19"") is approaching 80K miles."
14xsvag,"Given that these cars don't typically require routine maintenance/inspections, how will I know when my friction brakes are getting low?"
14xsvag,When (how many miles?
14xsvag,) should I have them inspected/serviced?
14xsvag,Preferably before they start scoring the rotors.
14xsvag,I know everyone uses their brakes/drives their car differently.
14xsvag,"I use regenerative braking a lot, but I still use the friction brakes (usually briefly) at least 5-8 times per day over the course of \~140 miles daily."
14xsvag,These are mostly to assist Regen (decelerate/stop faster/in time) plus the occasional (0-1 /day) panic stop.
14xsvag,If there's two things I would complain about on my car it's the excessively harsh ride/suspension and the rather middling break performance.
14xsvag,"Yes, it's a very heavy car, but still I wish the friction brakes were more assertive."
1ccg6hp,FSD Supervised Needs Supervision It’s a complete downgrade from when I used it in 2022.
1ccg6hp,Summon: Its a broken feature.
1ccg6hp,I used the summon feature in parking lots on multiple occasions and the car literally takes the most direct route to me.
1ccg6hp,And I mean DIRECT.
1ccg6hp,Literally went over a parking lot median to try to get to me.
1ccg6hp,It’s an empty parking lot at that.
1ccg6hp,"The old version FSD, while it had its problems, would never do this."
1ccg6hp,Same parking lots from 2022.
1ccg6hp,Auto-park: EMBARRASSING.
1ccg6hp,FSD: LANE CHANGES.
1ccg6hp,Please for the love of god don’t forget to tap Minimal Lane Changes.
1ccg6hp,The car will switch lanes .
1ccg6hp,5 miles from your exit… in heavy traffic for “faster lane changing” or what ever it says.
1ccg6hp,AWARENESS and CRITICALITY.
1ccg6hp,The car will go 60mph or what ever your speed is 400 feet from a red light and will abuse the brakes on approach.
1ccg6hp,"Also, Plenty of times the car would zoom out of the far right lane into a turnaround/turning lane to the right thinking that’s the lane…even in situations where it should be able to see that the turn lanes end dangerously close for it to swerve into the lane AND keep its speed."
1ccg6hp,"ASSERTIVE, CHILL, AND I forget the other mode."
1ccg6hp,No explanation on what these modes really mean as it pertains to trafficability.
1ccg6hp,Considering the car is driving by itself this should be explained for obvious safety and intuitive reasons.
1ccg6hp,"Overall, it’s very embarrassing and nerve wracking to use."
1ccg6hp,Only useful when you are on a freeway driving a long linear route.
1ccg6hp,There’s autopilot for that.
1ccg6hp,Probably more that I am forgetting but these are some things I found extremely terrifying.
1ccg6hp,"Not sure if it’s because ppl complained about how cautious it used to be, but now FSD DGAF"
1bj0dnb,FSD V12.3 disables TACCPretty much in the heading .....
1bj0dnb,Got FSD v12.3 update this evening ..
1bj0dnb,"now Autopilot Activation (Single/Double Pull), in Car> Autopilot menu, is disabled if you enable ""Full Self Driving""...."
1bj0dnb,"Not that I ever used TACC, now that they disabled it, I miss it, lol :)"
yo3hka,Debating if I encountered a conman at my vehicle pick upI bought a used model 3 last week at Tesla store.
yo3hka,"Paid 600 deposit , went to the store , I saw the exterior of the vehicle and it looked good."
yo3hka,"I went inside the store and was trying to be polite with one senior sales guy and was asking , how can I see the vehicle interior before deciding if I should continue with the vehicle."
yo3hka,The guy immediately says to open my Tesla app and review the agreements and asked me to press ACCEPT DELIVERY so I can get the keys and check the vehicle interior.
yo3hka,I am wondering if it's misleading.
yo3hka,Would I have been able to return the vehicle if I found something wrong in the interior ?
yo3hka,"The vehicle turned out to be mostly good except for some bad smell , previous owner hairs and spit marks on the right door handles  Was the sales guy a conman for just focussing on just asserting me to press the ACCEPT DELIVERY button ?"
yo3hka,He also was rushing to close my case and send me out.
yo3hka,The reason I decided to shop at Tesla is to avoid conmen from regular car dealerships.
yo3hka,"Please let me know who is at wrong , and If I should bring this to Tesla's notice."
1854dvi,Follow distance settingI’ve been super lazy and ignored the change Tesla made several versions back.
1854dvi,I used to be able to set the AP follow distance by the scroll wheel left/right.
1854dvi,They seemed to have changed this and I can’t figure out an easy way to change this on the fly.
1854dvi,My right scroll wheel shows auto pilot options chill average or aggressive.
1854dvi,Does not adjust follow distance.
1854dvi,Curious what you all are doing with this and how to quickly get to it?
1854dvi,Thanks in advance.
166ujzn,2023.7.
166ujzn,30 going wide just got it in dfw 11.4.
166ujzn,7
wli231,How bad is the ride quality with 20inch rims vs 18
qfncaf,The $2k test driveLast weekend I got serious about a Model Y and called Tesla to set up a test drive.
qfncaf,They didn’t have anything that weekend so I scheduled for the following Saturday.
qfncaf,The sales rep called that afternoon and asked if I wanted to go ahead and put in an order to lock in pricing but I said no I didn’t want to do that without driving one.
qfncaf,Well you know how this goes.
qfncaf,Saturday comes and we drive it and my wife loved it.
qfncaf,"So I go to order and yep, pricing updates hit and this test drive cost me $2k."
qfncaf,"My point, if you have any idea at all that you may order, lock in pricing."
qfncaf,$250 is nothing compared to what you will lose in pricing jumps moving forward.
171ubsx,New FSD updateAny noticeable difference after update?
171ubsx,Is it drivable  on citi streets now
14jtudl,2023.7.
14jtudl,20 FSD Beta 11.4.
14jtudl,4Anyone else get ?
7fe0my,Anyone else seeing the obvious smear campaign against Tesla and Elon Musk that is going on through social media and seeping in to mainstream news?
7fe0my,There is an obvious (and paid for) smear/shill campaign against Tesla and Elon Musk by Wallstreet short-sellers and the oil industry.
7fe0my,You can see it in the shill posts and comments around social media where they use the same talking points and use well-documented tactics to sow doubt and the illusion that Tesla is about to go under.
7fe0my,See [this post] (https://np.
7fe0my,reddit.com/r/worldnews/comments/31wo57/the_chevron_tapes_video_shows_oil_giant_allegedly/cq5uhse/) about how lobbyists pay PR companies to smear the competition.
7fe0my,"Such talking points I'm seeing constantly being cycled include:  - Tesla unable to scale up production  - Tesla cars catching fire (you can thank the mainstream media for picking up this bullshit story and spreading it)  - Autopilot causing accidents  - Tesla ""making record quarterly losses"" (this one is particularly deceitful because the quarterly losses were forecast and planned due to scaling up production, and these headlines make the reader think they are going under when in fact it is completely normal)  - Tesla workforce issues (most recently that story about racism that was no more than what other large companies deal with on a daily basis)  - Rumours of Elon leaving Tesla (As if he would)  - Sowing doubt about Tesla cars range to spread range anxiety  - General fud about Tesla's financial position  - False assertions that Tesla cars produce more pollution than petrol cars due to electricity production and manufacturing    Elon recently said in an interview that short-sellers have been doing this and have obvious financial incentives to do so."
7fe0my,Given how much money short-sellers have now lost I believe they are going in to overdrive to bring the share price down at this critical juncture with the Model 3 going in to mass production.
7fe0my,We need to make people aware of these efforts so that they don't believe this crap.
1bqvqgv,"My FSD V12.3 beta experience as an infrequent user (Very good)I'm in infrequent user because I don't work very far away, less than 5 miles commute and because FSD would be weird and I'd intervene in one or two key places often."
1bqvqgv,I also go to Florida once a year from New York where I use FSD exclusively on the highways and like 75% of the local driving.
1bqvqgv,I own a Mid range Model 3 early 2019.
1bqvqgv,"So far it's been a massive upgrade, like I can see why Elon is so ""gung ho"" about pushing FSD trials(I still think he's being pushy)."
1bqvqgv,Autopilot/Full Self Driving beta is in a different place now compared to any other version that merely looked and performed like an upgraded version of the last.
1bqvqgv,It's very smooth and very human like.
1bqvqgv,Steering wheel still looks a little robotic on full 90 degree turns but I'd guess it looks fine from outside.
1bqvqgv,"While V11 could take me to work without intervention on some routes I'd rarely let it do that because of pot holes (I live in New York after all) and turning, turning left or right especially sharp turns would get a lot of hesitation from the car."
1bqvqgv,It would never be a danger but it was certainly a strong annoyance because of how long it would take or how much you see the wheel go back and forth.
1bqvqgv,V12 does a significantly better job at this.
1bqvqgv,Very little steering wheel back and forth and the maneuver is performed much faster and smoother.
1bqvqgv,Stop Signs   This is the Achilles heel of FSD V12.
1bqvqgv,It's not great.
1bqvqgv,"V11 was worse, the NHTSA stop is certainly annoying but even after a full stop which I honestly don't mind that much, the car hesitates even when there's no other moving vehicles on the road."
1bqvqgv,From all other stops it accelerates quickly which is great but stop signs gotta be the most cumbersome stops for FSD.
1bqvqgv,"It works and it's gotten a lot better but it is too nice and too hesitant and I dislike that the car stops well before the stop line and sometimes before the stop sign (which are brought forward so the driver sees it sooner, not moving the stop line closer)."
1bqvqgv,Average driving speed is unusually low.
1bqvqgv,This might have been a conscious choice for safety and/or processing of FSD but previous FSD versions kept the set speeds much closer to our goals where as current FSD V12 is closer to speed limit and granny speeds excluding fast accelerations.
1bqvqgv,"All that said the car feels like it's 93% ready (in my unscientific guess) for the ""Supervised Driving Assistant"" that they will be advertising soon."
1bqvqgv,"They need to get better with the stop signs and identifying traffic and moving vehicles for stops signs so the car can move on quicker, stop closer to the point the cars needs to in order to see traffic and improve average driving speed."
e2t2tk,2019.40.1.
e2t2tk,1 being installed right now!
e2t2tk,"Update: Installation done, not a beta, same release notes as 2019.40.1 referenced in that Twitter pic post."
e2t2tk,**Release Notes pic**  http://imgur.com/a/qy4EBIR  Full version info: v10.1 (2019.40.1.
e2t2tk,1 861901a57768)    **Release notes** (via Google lens ocr)  **Automatic Wiper Improvements**        Automatic wipers have been improved to be more likely to activate when it is lightly raining and respond to changes in rain intensity for more environments.
e2t2tk,The automatic wipers are now employing the first production deep neural network trained with over 1 million images for the detection of water droplets on a windshield and additional weather cues.
e2t2tk,"If automatic wipers is not performing to your preference, any manual adjustment to wiper speed will be captured to further train and improve the network in future software updates."
e2t2tk,"To enable automatic wipers, tap the windshield wiper icon located in the ""Cards"" area on the touchscreen and select AUTO."
e2t2tk,**Automatic Lane Change Improvements**     Automatic lane changes have been tuned to make lane changes with more confidence.
e2t2tk,"When the adjacent lane is detected to be open, automatic lane changes will initiate faster and be more assertive."
e2t2tk,"To further increase assertiveness of lane changes, select MAD MAX for SPEED BASED LANE CHANGES by tapping Controls > Autopilot > CUSTOMIZE NAVIGATE ON AUTOPILOT."
e2t2tk,*This release contains minor improvements and bug fixes.
e2t2tk,"*  -----------------  (Pre install finished post text):     I'm not sure if this is an Early Access build or not, but I was surprised to see no mention of this on Google search, TeslaFi, or here!"
e2t2tk,Will update with the release notes as soon as it's done.
e2t2tk,"I've been in Early Access for over a year, and I got pushed from an EA build to regular a few months ago, when Smart Summon hit general release."
e2t2tk,"Im hoping this is an Early Access build, since the next one is supposed to have some more FSD features...."
e2t2tk,Btw some background on getting into Early Access:      I bought FSD with my Model3 LR purchase in June 2018.
e2t2tk,"I've been providing bug reports via voice ""Report bug bla bla"" on autopilot issues very frequently."
e2t2tk,"I recently had a Tesla ""Remote"" tech do some maintenance, and he mentioned he remotely looks at a lot of Autopilot bug reports."
e2t2tk,He confirmed that the bug reports via voice do get remotely looked at.
e2t2tk,He did recommend trying to verbalize such that the text-to-speech looks correct.
e2t2tk,Otherwise they just throw it in the trash.
e2t2tk,He also recommended that the report should be done immediately since there **so much** log data it's a pain to go too far back.
e2t2tk,"For any reports over email, he recommended accurate a timestamp as possible (minute level is good), and a GPS location is nice to have as well."
e2t2tk,"I mentioned I go on Google maps and use Street view to pinpoint the location, and he said that's extremely helpful."
e2t2tk,But he really stressed on getting the timestamp accurate.
e2t2tk,"Oo the car rebooted, can't wait to get screenshots of the release notes!"
e2t2tk,"2nd reboot, 80%, no..."
e2t2tk,30% now.
e2t2tk,"Might've misread it, or it pulled a ""File Explorer copy progress %"" on me."
e2t2tk,3rd reboot!
e2t2tk,!
e2t2tk,Finally complete!
e2t2tk,!
e2t2tk,!
abmxx2,"the test swerveWhen I used to be into road bike racing, I would sometimes swerve toward a line racers to see how they would react and if anyone hits the breaks, I could jump into the space created in front of them when they slow down."
abmxx2,"I have never been so aggressive about taking a lane on the highway, but I've noticed that when I use autopilot to change lanes, it seems to use this tactic of swerving toward the lane it's trying to get into, startling drivers into hitting the brakes and then jumping into the space created when they do."
abmxx2,Is anyone else surprised by how assertive autopilot is when changing lanes?
8y1ngw,"Takeaways from investors meetings with Senior Director of Investor Relations Aaron Chew from TuesdayOn Tuesday, Tesla spoke with large investors on site (and they toured the tent), lead by Senior Director of IR, Aaron Chew."
8y1ngw,I'm piecing together information from different sources (both public and private) and I'll be stealing some quotes from Bank of America Merrill Lynch as they had a nice writeup and opinion of it (noted by block quotes).
8y1ngw,"**Model 3 production**  GA3 was running at 4K a week  GA4 made up the additional 1K (to get to the 5K goal)  They expect GA3 to ramp up to 5K a week and keeping GA4 stagnant at 1K by the end of the month, making 6K a week but realistically running a 5K a week rate sustainably for all of Q3 2018."
8y1ngw,"Q3: 5K/week  ~Q4: 7K/week  ~Mid-2019: 10K/week  > Although TSLA is confident in the sustainability of its production rate, based on its past challenges in ramping up production, we remain somewhat skeptica land believe it will take some time before the Model 3 production reaches material scale."
8y1ngw,**Full Self Driving**  Tesla noted they are not on the same path as other companies when it comes to getting to level 4-5 autonomy.
8y1ngw,"While some companies are open road testing those levels, Tesla is doing their testing behind the scenes."
8y1ngw,"Tesla has cars with level 2-3 (V1) available in the public but are still a bit off from road testing level 4-5 (V2)  >  And while TSLA is currently in development phase of V2.0 AV (entering validation phase), commercialization of the technology is still some ways off, although TSLA will likely launch some mobility model  **China Factory**  Reached agreement to build a factory with planned capacity of 500K."
8y1ngw,"Did not disclose how that was going to be built, when it will be started/finished, and how much it would cost."
8y1ngw,"They did expect it to be funded like capex in the past: funding from cash flows, co-funding with other sources, capex deferrals)."
8y1ngw,"> In our view, this is a prudent move to not only tap into the largest electric vehicle market, but also to mitigate trade risk in light of escalating trade war tensions globally."
8y1ngw,"Also of note, in response to tariffs imposed by the US, China recently raised the tariff on US-manufactured vehicles imported into China to 40%, which forced TSLA to materially raise prices on its vehicles sold in the China market."
8y1ngw,**Capital Raise**  Tesla did re-affirm that they will not require an equity or debt raise this year.
8y1ngw,">  We would note that customers are now required to pay an additional $2,500 to configure the Model 3, which, based on the current reservation count of 420k, could equate to a $1bn cash infusion, and may buy a few quarters before TSLA needs to return to the capital markets."
8y1ngw,"**Merrill Lynch on competition:**  > Although TSLA is trailblazer within the electric vehicle market, we believe competition is heating up from both incumbent players and newer entrants looking to capitalize on the high-growth space."
8y1ngw,"We would highlight planned new vehicle launches (per our Car Wars analysis) from BMW (i platform), Daimler (EQ platform), Audi (e-tron platform), and most notably Porsche (Taycan, Mission E Cross Turismo), as well as an aggressive push from newer China/Asia OEMs such as BYD, Byton, Geely/Polestar/Volvo, and NIO."
8y1ngw,"In addition, some companies may pursue a vertical integration of battery/electric vehicle manufacturing (in the same way as TSLA), with the recent agreement between BMW and CATL being an example."
8y1ngw,"However, it does not yet appear that TSLA perceives these efforts as a major competitive threat, and we would admit the market vacuum still exists for now."
b0pzq5,2019.5.
b0pzq5,"15 NoA seems a good deal better, but still needs workI got a couple chances to try out NoA today on 2019.5."
b0pzq5,15 in my M3 LR RWD w/ EAP.
b0pzq5,Comparison is from 2018.50.6.
b0pzq5,tl;dr it's better but still needs work.
b0pzq5,"My baseline experience was from a test done in early Feb during a 2,600 mile road trip, which was my first extended experience with NoA."
b0pzq5,My conclusion then was that it was seriously lacking in a number of ways.
b0pzq5,"I tried both ""Average"" and ""Mad Max"" settings in a number of different traffic conditions."
b0pzq5,"Unless the action was obviously unsafe, I followed suggestions."
b0pzq5,"I was watching carefully, and attempted to respond to suggestions quickly."
b0pzq5,"Needless to say, this isn't a fully controlled test by any means, but in both cases (before/after) I was attempting to collect, classify, and assess a set of cases."
b0pzq5,"**NoA on 2018.50.6**  * hesitant/not confident in many key cases * frequently was either late or early but rarely on time for lane changes * often notified of upcoming lane change for no apparent reason * often suggested lane changes when a car was approaching from behind * after manually changing lanes then came up behind slow vehicle, waited a long time before suggesting lane change * frequent cancellation of lane change in progress * handled only the most gentle and tame interchanges  **NoA on 2019.5."
b0pzq5,"15**  * Generally more confident and decisive * Most lane change suggestions timing about right * No false upcoming lane change notices * Smarter ""get in the right lane before interchange"" process * Quicker ""return to travel lane after passing"" process * New ""Tap to Delay"" on display notification of upcoming lane change * Still seems to wait for a long time after manual lane change then coming behind slow vehicle * Only one failed lane change due to car approaching from behind, 5 or 6 others ok * Handled several complex interchanges in heavy traffic well, failed completely on one of them  Overall, this seems like a substantial incremental improvement."
b0pzq5,"The ""Tap to Delay"" feature seems like a good idea, and perhaps a way for Tesla to get feedback."
b0pzq5,"In my first test, I had numerous cases where my driving on NoA pissed off people behind; today there was only one case of this."
b0pzq5,Tests were in Boston area in typically heavy mid-day traffic.
b0pzq5,"Based on my 2,600 mile road trip, Boston (and perhaps metro New York) have a *very* high degree of difficulty."
b0pzq5,"Road conditions were dry, but there's still salt on roads, which significantly reduces contrast between road and lane markings."
b0pzq5,"Boston is highly congested, and we drive ..."
b0pzq5,assertively.
b0pzq5,"In one interchange test today (I 95 N onto I 93 S) the NoA system did a good job moving me from the leftmost lane to the rightmost lane over a mile, waiting for good opportunities to suggest changes, and then executing the change crisply."
b0pzq5,"When it got to the off ramp, however it got confused and made several swerves that forced me to take over."
b0pzq5,This is a very hard intersection and traffic was as challenging as it gets.
b0pzq5,Also line markings were hard to see.
b0pzq5,"But this is not a system that can work ""most of the time"" and leave you to pick up in the middle of a tense situation ..."
b0pzq5,"yes, I know that's exactly what the system is now, and I fully accept that, and am only reporting my perceptions and opinion as a driver hoping it will continue to get better -- these kinds of events significantly reduce my confidence in the system, and I suspect less tolerant drivers may feel the same way."
b0pzq5,"The failed/cancelled lane change was a far more basic and common situation: I was in middle lane behind a slower truck that a string of cars were passing, waiting for an opportunity to pass myself."
b0pzq5,"I was impressed that the system recommended a change when there was an opening, and it was fairly quick to act after I confirmed."
b0pzq5,"But it didn't accelerate, and then had to bail out, which was confusing and alarming for me and for the driver behind me."
b0pzq5,"This case seems like a solvable one to me, and perhaps it's on the way but still needs work, IMO."
b0pzq5,"Beyond NoA, it seems like several other functions work a good deal better after the 2019.5."
b0pzq5,"15 update -- less abrupt braking, more smooth response to other cars and conditions that previously resulted in more dramatic/sudden braking, crisper lane changing in general."
b0pzq5,"Overall, I am just happy to see that AP functionality is making progress just as we would expect: several months of new data, presumably."
b0pzq5,Props to the Data Science team at Tesla!
s0gk0m,Tesla 'Full Self-Driving' beta features an 'Assertive' mode with rolling stops | Engadget
1cc51xo,Did the “Follow Distance” Menu Item Move Somewhere Else?
1cc51xo,"Not sure if this is related to my current free trial of FSD, but when I side-clicked on the right thumb wheel today I didn’t see the “follow distance” selector (2 3 or 4 car lengths) that I had seen there previously."
1cc51xo,"Instead, I saw a new screen come up with “autopilot settings” with chill/average/assertive options."
1cc51xo,Did the follow-distance selector move elsewhere or has it been replaced by this new (and more vague) option set?
1bt61bp,FSD drives embarrassingly hesitantEverytime when approaching an intersection.
1bt61bp,Only feel comfortable when there is no car behide me and there is very few traffic...
1bt61bp,Otherwise I just can't stop wondering whether I pissed off the car behind me.
1bt61bp,"MY, HW4, 12.3."
1bt61bp,2.1
16nx97d,Why isn't Minimal Lane Change the default?
11ap03o,I don’t even have FSD beta turned on and twice I’ve gotten strikes out.
11ap03o,Was from normal autopilot (hand not heavy enough on the wheel).
11ap03o,Is this a thing now?
15iyum7,Is there any money in building a super charger station?
15iyum7,There’s a place I’ve seen for sale that I feel like it would be a good place for charging and have wondered if it could be profitable.
12bi3bx,Rant - FSD 11.3 NHTSA recall is terrible!
12bi3bx,TLDR: NHTSA saying rolling stops isn't allowed because it breaks the law is hypocritical because they allow setting the max speed above the speed limit and both are behaviors most drivers do.
12bi3bx,I'll start by saying I have to go through 7 stop signs to leave/enter my neighborhood and their new requirement that fsd must come to a complete 0 mph stop makes me the 1% of my neighbors that does this instead of a rolling stop at 2-3 mph the other 99% does so I don't use it much in my neighborhood.
12bi3bx,It throws off the timing when others arrive at the intersection after me but beta thinks they need to go first because I haven't fully stopped yet.
12bi3bx,I get they want self driving cars to follow the law exactly but what really annoys me is that I can set the speed offset +30% above the speed limit and that's not just Tesla but every car manufacturer can set cruise control above the speed limit (Volvo can go 125 mph and BlueCruise +20 mph over speed limit).
